date,heure,titre,lieu,description,type
2026-02-15,18:00,Réunion publique de lancement,Salle Jean Jaurès - 12 rue du 8 Mai 1945,Présentation officielle de notre liste et de notre programme pour Nanterre,meeting
2026-02-20,10:00,Rencontre au marché,Marché de la Place de la République,Venez discuter avec notre équipe de vos préoccupations quotidiennes,terrain
2026-02-25,19:30,Débat sur l'écologie urbaine,Maison de l'Environnement,Comment verdir Nanterre ? Échanges et propositions citoyennes,conference
2026-03-02,14:00,Porte-à-porte quartier Pablo Picasso,RDV devant la médiathèque,Rejoignez-nous pour aller à la rencontre des habitants,terrain
2026-03-08,18:30,Réunion publique éducation et jeunesse,École élémentaire Victor Hugo,L'avenir de nos enfants au cœur de notre projet,meeting
2026-03-12,10:30,Petit-déjeuner citoyen,Café de la Mairie - Place Gabriel Péri,Un moment convivial pour échanger autour d'un café,terrain
2026-03-18,20:00,Grand meeting de campagne,Théâtre des Amandiers,Rassemblement pour notre ville avec tous nos soutiens,meeting
